{"instruments":[{"label":"Guitar","stems":[{"bytes":24,"content_type":"audio/mpeg","path":"guitar.mp3","role":"target","sha256":"01316c8ec960ebe91747508e865d42eef794073d8d6c17eeb87d6f495bcb760b"},{"bytes":24,"content_type":"audio/mpeg","path":"guitar.backing.mp3","role":"backing","sha256":"01316c8ec960ebe91747508e865d42eef794073d8d6c17eeb87d6f495bcb760b"}],"target":"guitar"}],"original":{"bytes":24,"content_type":"audio/mpeg","path":"original.mp3","sha256":"01316c8ec960ebe91747508e865d42eef794073d8d6c17eeb87d6f495bcb760b"},"schema_version":"1.0","song_id":"0123456789ab","source":{"algorithm":"sha1","cache_key":"0123456789ab","digest":"0123456789abcdef0123456789abcdef01234567"},"title":"Test Song","updated_at":"2026-08-29T00:00:00.000Z"}
